"conversation_id_str","created_at","favorite_count","full_text","id_str","image_url","in_reply_to_screen_name","lang","location","quote_count","reply_count","retweet_count","tweet_url","user_id_str","username"
"1774545178071863610","Sun Mar 31 21:11:54 +0000 2024","0","halo min saya udh registrasi untuk pemasangan indihome cuma ada kesalahan di nomor telponnya bisa diubah ngga ya? @IndiHomeCare","1774545178071863610","","","in","02","0","1","0","https://x.com/lobelywhale/status/1774545178071863610","1104926442658230272","lobelywhale"
"1774460703371620602","Sun Mar 31 15:36:14 +0000 2024","1","indihome lemot banget yaampunnnnnnn @IndiHome","1774460703371620602","","","in","Sidoarjo, Indonesia","0","1","0","https://x.com/Lrsfaaa/status/1774460703371620602","496610135","Lrsfaaa"
"1774300852129608026","Sun Mar 31 05:01:02 +0000 2024","0","halo min saya mau pasang wifi indihome baru lewat apk tapi datanya masih verifikasi trs udh 2 hari kira2 brp lama ya verifikasinya?@IndiHomeCare","1774300852129608026","","","in","02","0","2","0","https://x.com/lobelywhale/status/1774300852129608026","1104926442658230272","lobelywhale"
"1774527471712616627","Sun Mar 31 20:01:33 +0000 2024","0","Indihome saya lemot min. Tolong diatasi @IndiHomeCare @IndiHome","1774527471712616627","","","in","Kudus, Indonesia","0","2","0","https://x.com/dimashwn/status/1774527471712616627","356052149","dimashwn"
"1774263609100832777","Sun Mar 31 02:33:03 +0000 2024","0","LEMOT BGT ELU JIR @IndiHome gua udah bayar","1774263609100832777","","","in","","1","2","0","https://x.com/rrasyadhira/status/1774263609100832777","871996388074180608","rrasyadhira"
"1774256876949221383","Sun Mar 31 02:06:18 +0000 2024","0","Min tolong wifiku down sejak kemarin @indihomekti @IndiHome @IndiHomeCare","1774256876949221383","","","in","Central Sulawesi, Indonesia","0","1","0","https://x.com/MollysAbdie/status/1774256876949221383","1680355255","MollysAbdie"
"1773973894422258118","Sat Mar 30 07:21:49 +0000 2024","0","bro sinyal lo jelek dari kemaren!!!! @IndiHome @IndiHomeCare","1773973894422258118","","","in","","0","1","1","https://x.com/cutiepiefllsun/status/1773973894422258118","1140685262692835328","cutiepiefllsun"
"1774490987504849387","Sun Mar 31 17:36:34 +0000 2024","0","Ada yang Baru dari IndiHome https://t.co/XQAtyupfPr","1774490987504849387","","","in","","0","0","0","https://x.com/VIVAcoid/status/1774490987504849387","41730943","VIVAcoid"
