
"1803304489677705568","Wed Jun 19 05:51:08 +0000 2024","1","Bayar Tagihan Indihome di OVO mayan nih dpt Cashback 5% s/d 25rb Pastikan vouchernya terpasang https://t.co/SkJrXwrjPw","1803304489677705568","https://pbs.twimg.com/media/GQaf4HaaIAAyl2X.jpg","","in","Indonesia","0","2","0","https://x.com/AkulahPara/status/1803304489677705568","1640451055111778310","AkulahPara"
"1803921569397510575","Thu Jun 20 22:43:12 +0000 2024","0","tolong indihome ini knp pls https://t.co/IcLLphnVQB","1803921569397510575","https://pbs.twimg.com/media/GQjRGuzakAYHC_v.jpg","","in","","0","7","0","https://x.com/jwonwoobasudara/status/1803921569397510575","1234039472674627585","jwonwoobasudara"
"1803823521811894443","Thu Jun 20 16:13:35 +0000 2024","0","240p baru lancar emang brengsek indihome wkwk https://t.co/cilYiroguU","1803823521811894443","https://pbs.twimg.com/media/GQh32BMaYAA4NU9.jpg","","in","#floniverse","0","0","0","https://x.com/psiagani23/status/1803823521811894443","134341937","psiagani23"
"1803759256367464824","Thu Jun 20 11:58:13 +0000 2024","4","Hati-hati konten ini mengandung jokes bapak-bapak yang dapat membuat kamu tertawa terbahak-bahak. Konsep jodoh gak kemana-mana tuh bukan kaya begitu Pak #IndiHomebyTelkomsel #DariRumahTanpaBatas https://t.co/Sns93LI2fS","1803759256367464824","https://pbs.twimg.com/media/GQg9fBEaAAAvBgv.jpg","","in","","0","0","0","https://x.com/IndiHome/status/1803759256367464824","1075673058931806208","IndiHome"
"1803620859166466522","Thu Jun 20 02:48:17 +0000 2024","5","Starlink resmi beroperasi di Indonesia! Perusahaan layanan internet milik Elon Musk itu memiliki sejumlah perbedaan dengan perusahaan penyedia layanan fixed broadband seperti IndiHome Biznet hingga First Media. Ini bukan promosi ya cuma berbagi informasi aja https://t.co/SOk5ue15Hb","1803620859166466522","https://pbs.twimg.com/media/GQe-m-IbgAAjncH.jpg","","in","Unknown Metaverse ","0","2","2","https://x.com/Iconman221/status/1803620859166466522","1501028490279518208","Iconman221"
"1803635265686348285","Thu Jun 20 03:45:31 +0000 2024","0","Indihome iki kok jancuk yo????? Seng genah ae poo tnc e iku seng pasti ojok mencla mencle cuk! @IndiHomeCare MOSOK CS ONLINE SAMA YANG DI GRAPARI BEDO JAWABANE??? Gatel. https://t.co/MELWZwnMvu","1803635265686348285","https://pbs.twimg.com/media/GQfMtfOaIAE0GlO.jpg","","in","97 girl","0","2","0","https://x.com/fortaekim/status/1803635265686348285","403064792","fortaekim"
"1803700350500872518","Thu Jun 20 08:04:09 +0000 2024","2","Apapun request-an dari Bapak Adek Kakak semuanya bisa Ibu kerjain ditemenin tutorial dari internet ditemenin IndiHome pastinya. #IndiHomebyTelkomsel #DariRumahTanpaBatas https://t.co/j0lrrNCUTy","1803700350500872518","https://pbs.twimg.com/media/GQgH6O3boAAcV9U.jpg","","in","","0","0","0","https://x.com/IndiHome/status/1803700350500872518","1075673058931806208","IndiHome"
"1803427082480779360","Wed Jun 19 13:58:17 +0000 2024","0","- X Premium Basic - Adobe CC - YouTube - Spotify - Netflix - Discord Nitro - Google One - Duolingo - Prime - Disney+ - Indihome Dari langganan di atas ada yang pake paket family dapet gratisan paket internet sama langganan sendiri dapet diskonan jadi nggak terlalu boncos ","1803427082480779360","","","in","Yogyakarta, Indonesia","0","1","0","https://x.com/dhiodhaha/status/1803427082480779360","99024126","dhiodhaha"
"1803381927266894288","Wed Jun 19 10:58:51 +0000 2024","0","Telat bayar tagihan Indihome? Sekarang tidak lagi! Rahasianya adalah geser slide ke kanan yah #bayarangsuran #bayar #Angsuran #BayarIndihome #Indihome #Indihometelatbayar https://t.co/OUf8OEQnmE","1803381927266894288","https://pbs.twimg.com/media/GQbmQugaIAAXgwJ.jpg","","in","Mega Kuningan Jakarta,","0","0","0","https://x.com/mds_coop/status/1803381927266894288","1535160196133048321","mds_coop"
"1803604757439001057","Thu Jun 20 01:44:18 +0000 2024","3","Ada anak indihome yang bisa nafsir dan mengartikan mimpi gak :) lagi perlu urgen t .","1803604757439001057","","","in","Makassar, Indonesia","0","2","0","https://x.com/wolfhhy/status/1803604757439001057","1679748089891139584","wolfhhy"
"1803472206581866831","Wed Jun 19 16:57:35 +0000 2024","0","indihome kalian lagi jelek ga jaringannya?","1803472206581866831","","","in","","0","2","0","https://x.com/UjangDeresbgt/status/1803472206581866831","1717188745227862016","UjangDeresbgt"
"1803830256949657636","Thu Jun 20 16:40:21 +0000 2024","1","Ini Juni cepat amat dahklo ga ada notif Indihome buat terakhir bayar gua ga sadar klo udah pertengahan bln trs jg gua ga sadar fyp isinya papi dibandara gua kira foto lama grgr doi kan suka pke item trs pas inget langsung mikir ini FM mami ya bentar lg kira²hanbin nonton ga ya","1803830256949657636","","","in","Indonesia","0","1","0","https://x.com/konnady/status/1803830256949657636","1225056916344205312","konnady"
"1803617861736525928","Thu Jun 20 02:36:22 +0000 2024","0","Jangan lupa ingatkan pelanggan bayar tagihan sekarang Waktunya bayar: Tagihan listrik PLN Bayar PDAM Telkom-IndiHome Internet &amp; TV Multifinance Gas PGN Bayar semua tagihan di Kiosbank tambah cuan dan berkah https://t.co/ZWAsob5cih","1803617861736525928","https://pbs.twimg.com/media/GQe8zE7aIAUQ6E1.jpg","","in","Jakarta Capital Region","0","0","0","https://x.com/kiosbankID/status/1803617861736525928","844430219054370816","kiosbankID"
"1803427225821155821","Wed Jun 19 13:58:51 +0000 2024","0","Yuk siapa yang mau temenan sama BA IndiHome? :)","1803427225821155821","","","in","20.↑","0","1","0","https://x.com/faxtui/status/1803427225821155821","1758821834060132352","faxtui"
"1803615117466280389","Thu Jun 20 02:25:28 +0000 2024","0","ini internet indihome knp lagiii sikkkk","1803615117466280389","","","in","@the__and.y ₊˚⊹ ᰔ","0","1","0","https://x.com/liljiseongp/status/1803615117466280389","1516659424601190400","liljiseongp"
"1803856759947448495","Thu Jun 20 18:25:40 +0000 2024","0","ni indihome gue kenapa lagi sih?? tadi mau bayar jam 11 gabisa baru bisa bayar jam setengah 1 tadi otomatis kena denda. trus sekarang gabisa dipake hadehhh","1803856759947448495","","","in","cawang, jaktim","0","5","0","https://x.com/ecst4shit/status/1803856759947448495","1237630954018992130","ecst4shit"
"1803266222039113949","Wed Jun 19 03:19:05 +0000 2024","2","knapaaa sii ini indihome masih pagi lohhh arrrrggghh","1803266222039113949","","","in","Yogyakarta","0","1","0","https://x.com/asadilara_/status/1803266222039113949","1009639078386495489","asadilara_"
"1803799435186766052","Thu Jun 20 14:37:52 +0000 2024","0","jelek bgt anjg indihome lemot","1803799435186766052","","","in","Edinburgh","0","1","0","https://x.com/kikumiey/status/1803799435186766052","1654039748695199749","kikumiey"
"1803838186356879758","Thu Jun 20 17:11:51 +0000 2024","0","apa cona pas banget jam 12.10 indihome mati","1803838186356879758","","","in","Hell","0","2","0","https://x.com/cheesycheezz/status/1803838186356879758","736609825023352832","cheesycheezz"
"1803449115797594315","Wed Jun 19 15:25:50 +0000 2024","0","provider inisial indihome lemot bgt tai","1803449115797594315","","","in","🇵🇸","0","2","0","https://x.com/selissante/status/1803449115797594315","1411622739924774913","selissante"
"1803429226802217282","Wed Jun 19 14:06:48 +0000 2024","0","Benerin apa aplikasi IndiHome kalian susah banget di akses masuk. Kaco kaco lah @IndiHomeCare https://t.co/egG00jl71I","1803429226802217282","https://pbs.twimg.com/media/GQcRUxuaIAQ78Eb.jpg","","in","Monad","0","1","0","https://x.com/hunter_waitsee/status/1803429226802217282","1667099323212136448","hunter_waitsee"
"1803467983681102118","Wed Jun 19 16:40:48 +0000 2024","0","Tolong bantuannya dong @IndiHomeCare @IndiHome lagi asik2.. tiba2 jaringan wifi hilang dan muncul notifikasi LOS warna merah https://t.co/dJdktHbwhF","1803467983681102118","https://pbs.twimg.com/media/GQc0kZ7aIAAEyLS.jpg","","in","Indonesia tanah air beta","0","0","0","https://x.com/Alvinsaimima/status/1803467983681102118","123182786","Alvinsaimima"
"1803862773941833738","Thu Jun 20 18:49:34 +0000 2024","0","bener bener u yh indihome gua lg ngerjain askeppp woilaaa https://t.co/ce24IpIqsD","1803862773941833738","https://pbs.twimg.com/media/GQibohtakAIsuAk.jpg","","in","","0","1","0","https://x.com/flyinm0od/status/1803862773941833738","1275029590646243328","flyinm0od"
"1803866508315234354","Thu Jun 20 19:04:24 +0000 2024","0","indihome knp sih anj","1803866508315234354","","","in","","0","1","0","https://x.com/mayaumiyau/status/1803866508315234354","1296876054666080258","mayaumiyau"
"1803675988091388190","Thu Jun 20 06:27:20 +0000 2024","0","banyak banget orang IndiHome anjir pada disini","1803675988091388190","","","in","Jakarta Capital Region","0","1","0","https://x.com/Ihyanursamsie/status/1803675988091388190","1230913979444158464","Ihyanursamsie"
"1803935732064715085","Thu Jun 20 23:39:28 +0000 2024","0","Indihome sejak dipegang telkomsel jadi ga jelas administrasinya kirim eStatement masa setelah tanggal jatuh tempo. Dulu tuh kalau udah dibayar dikirimin email makasih udah bayar sekarang engga. Biar tau kl tagihannya lunas.","1803935732064715085","","","in","Indonesia, Jakarta","0","1","0","https://x.com/elftikajunior/status/1803935732064715085","50904815","elftikajunior"
"1803664828327718942","Thu Jun 20 05:43:00 +0000 2024","1","Untuk Bestee aku biar makin update tentang pengetahuannya. Jangan lupa follow akun Instagram @IndiHome.JatimBaliNusra dan @IndiHomeJTD juga ya bestee #IndiHomeMbois #IndiHome https://t.co/R049D6av0g","1803664828327718942","https://pbs.twimg.com/media/GQewyvrbYAA37Nb.jpg","","in","Surabaya, Jawa Timur","0","0","1","https://x.com/IndiHomeJBN/status/1803664828327718942","1386525471957917701","IndiHomeJBN"
"1803407247470633403","Wed Jun 19 12:39:28 +0000 2024","0","Tadi sorean tiba2 di WA sama orang ngaku teknisi Indihome. Bilang klo di sistem internet rumah w terdeteksi gangguan. Yaudah kan ku bilang aja nanti saya cek soalnya takut klo orang nipu atau mau maling.","1803407247470633403","","","in","Indonesia","0","1","0","https://x.com/esternnp/status/1803407247470633403","52372399","esternnp"
"1803407340068282832","Wed Jun 19 12:39:50 +0000 2024","0","yang mau aku cek khodamnya rep aku indihome rijal no pakde","1803407340068282832","","","in","🦢","0","13","0","https://x.com/omdonghyuck/status/1803407340068282832","1553923989063340032","omdonghyuck"
"1803699313203155145","Thu Jun 20 08:00:02 +0000 2024","2","Ga perlu repot bayar tagihan IndiHome dan https://t.co/sPFyNGsIWv bisa dari rumah aja. Kamu bisa bayar tagihan IndiHome dan https://t.co/sPFyNGsIWv di LinkAja! Simak informasi lengkap di tautan ini ya https://t.co/Bt1roScPLL Customer Service: https://t.co/WVrOoo35o0 https://t.co/q5vAlz9AaT","1803699313203155145","https://pbs.twimg.com/media/GQaQSMyaEAA2u7q.jpg","","in","","0","1","1","https://x.com/linkaja/status/1803699313203155145","3195998996","linkaja"
"1803816831724958044","Thu Jun 20 15:47:00 +0000 2024","0","kacau indihome knp buriq bgt asu","1803816831724958044","","","in","18-🎸 love my gf","0","2","0","https://x.com/larchmG/status/1803816831724958044","1307157877421875200","larchmG"
"1803101616201171258","Tue Jun 18 16:24:59 +0000 2024","0","mungkin disuruh tidue sm indihome babi","1803101616201171258","","","in","在你的脑海里","0","1","0","https://x.com/bittencherie/status/1803101616201171258","1789953825711034368","bittencherie"
"1803481317847498861","Wed Jun 19 17:33:47 +0000 2024","0","indihome ini kenapa ya tiap lewat jam 12 wifinya bapuk betul","1803481317847498861","","","in","","0","1","0","https://x.com/eaiuiiaoa/status/1803481317847498861","80823657","eaiuiiaoa"
"1803614709901566210","Thu Jun 20 02:23:51 +0000 2024","0","indihome bapuk bgt","1803614709901566210","","","in","","0","1","0","https://x.com/anothertazya/status/1803614709901566210","1649384334351294464","anothertazya"
"1803008640254976437","Tue Jun 18 10:15:32 +0000 2024","1","Mas mas indihome username nya apa asu kon passwordnya apa jancokkon Akhire aku gepuk gepukan ambek mas e ","1803008640254976437","","","in","+6231","0","1","0","https://x.com/Ekaprillio/status/1803008640254976437","107278739","Ekaprillio"
"1803938733722603887","Thu Jun 20 23:51:24 +0000 2024","5","beberapa hari ini kenapa dehh indihome lemoottt bgttt?!! ","1803938733722603887","","","in","","0","8","1","https://x.com/anxyclown/status/1803938733722603887","1114428388431675392","anxyclown"
"1803452373182062711","Wed Jun 19 15:38:46 +0000 2024","1","indihome kapan ya gak lemot jaringannya SETAN","1803452373182062711","","","in","kukuroo mountain ","0","1","0","https://x.com/cypherfist/status/1803452373182062711","972656749428670464","cypherfist"
"1803808951043326095","Thu Jun 20 15:15:41 +0000 2024","0","SEJAK KAPAAAAN INDIHOME NAIK KAMPREEET","1803808951043326095","","","in","","0","1","0","https://x.com/odytooo/status/1803808951043326095","320583365","odytooo"
"1803100617407447041","Tue Jun 18 16:21:01 +0000 2024","0","woi anjing indihome bisa ga sih stop ilang ilangan anjing","1803100617407447041","","","in","在你的脑海里","0","2","0","https://x.com/bittencherie/status/1803100617407447041","1789953825711034368","bittencherie"
"1803679604118634750","Thu Jun 20 06:41:43 +0000 2024","2","Sobat ada yang mau iPhone 15 dari IndiHome? Yuk langsung aja langganan Paket JITU sekarang lewat web atau aplikasi MyTelkomsel Promo berlaku sampai 30 Juni ya Sob. Segera langganan sekarang di MyTelkomsel atau kunjungi https://t.co/k0UV7OsZdF #IndiHome #IndiHomebyTelkomsel https://t.co/lCOhcWVCj1","1803679604118634750","https://pbs.twimg.com/ext_tw_video_thumb/1803679578923356160/pu/img/M6Doq6adLSRto0M-.jpg","","in","Semarang Tengah, Indonesia","0","0","0","https://x.com/SMGindihome/status/1803679604118634750","1093723147654688768","SMGindihome"
"1803092203180531716","Tue Jun 18 15:47:35 +0000 2024","1","Gaguna anj3ng @IndiHome https://t.co/sDoolU1Ex8","1803092203180531716","https://pbs.twimg.com/media/GQXewLmbgAAKQK2.jpg","","in","Malang, Jawa Timur","0","1","0","https://x.com/H_M_6l/status/1803092203180531716","1417292637531299842","H_M_6l"
"1803070378450784497","Tue Jun 18 14:20:52 +0000 2024","1","Sumpa nih cs indihome not helping at all anjir .. malah bikin emosi aja .. training lagi ga ","1803070378450784497","","","in","Malang, Jawa Timur","0","1","0","https://x.com/H_M_6l/status/1803070378450784497","1417292637531299842","H_M_6l"
"1803217567731032348","Wed Jun 19 00:05:44 +0000 2024","0","yg make indihome trouble ga sih dr semalem","1803217567731032348","","","in","Indonesia","0","1","0","https://x.com/whileinsfocus/status/1803217567731032348","981724946308128768","whileinsfocus"
"1803353131893530641","Wed Jun 19 09:04:25 +0000 2024","2","Fun fact buah manggis makanan bercita rasa manis dan asam pasti sudah tidak asing lagi dengan buah bernama manggis kan Sob. #IndiHome #IndiHomebyTelkomsel #buahmanggis #FunFacts https://t.co/xJow1dB4kJ","1803353131893530641","https://pbs.twimg.com/media/GQbMGs1bMAA1N-2.jpg","","in","Semarang Tengah, Indonesia","0","0","0","https://x.com/SMGindihome/status/1803353131893530641","1093723147654688768","SMGindihome"
"1803442795220226252","Wed Jun 19 15:00:43 +0000 2024","0","orang jahat lahir dari orang baik yg pasang indihome","1803442795220226252","","","in","","0","0","0","https://x.com/clvnanthny/status/1803442795220226252","1435699754","clvnanthny"
"1803842620684407176","Thu Jun 20 17:29:29 +0000 2024","0","Gua lupa bayar tapi anjinglah indihome mau bayar malah gak bisa","1803842620684407176","","","in","Situbondo.","0","1","0","https://x.com/Embut_kek/status/1803842620684407176","1333182553","Embut_kek"
"1803604540480209224","Thu Jun 20 01:43:26 +0000 2024","1","Untuk Bestee aku biar makin update tentang pengetahuannya. Jangan lupa follow akun Instagram @IndiHome.JatimBaliNusra dan @IndiHomeJTD juga ya bestee #IndiHomeMbois #IndiHome https://t.co/72QbyX1523","1803604540480209224","https://pbs.twimg.com/media/GQeww23boAAoloN.jpg","","in","Surabaya, Jawa Timur","0","0","1","https://x.com/IndiHomeJBN/status/1803604540480209224","1386525471957917701","IndiHomeJBN"
"1803868265233682768","Thu Jun 20 19:11:23 +0000 2024","0","WOI INDIHOME LG KENAPA SIH","1803868265233682768","","","in","","0","2","0","https://x.com/motherofjimbon/status/1803868265233682768","850961708688343040","motherofjimbon"
"1803419826280604089","Wed Jun 19 13:29:27 +0000 2024","0","Indihome dah bener² deh.. lemot banget dari kemaren ","1803419826280604089","","","in","","0","0","0","https://x.com/S0ljaecore/status/1803419826280604089","1567147693079949312","S0ljaecore"
"1803421421651321244","Wed Jun 19 13:35:47 +0000 2024","0","App indihome bisa lancar gk sekali2 ️ Bayar bulanan terakhir besok tapi sekarang appnya error hahsgsjjskl ️","1803421421651321244","","","in","she/her 𖹭","0","1","0","https://x.com/hanniibul/status/1803421421651321244","1668969288135507969","hanniibul"
"1802952018837053596","Tue Jun 18 06:30:33 +0000 2024","0","Sopo SG Ng kene kepengen ngantemi Indihome","1802952018837053596","","","in","Kebumen, Indonesia","0","1","0","https://x.com/Lo_Fee00/status/1802952018837053596","1237695505284476928","Lo_Fee00"
"1803344927436456421","Wed Jun 19 08:31:49 +0000 2024","0","Aku sudah mulai mengurangi subscription. Mulai dari paket IndiHome yang perbulan 800K sekarang udah pindah ke 400K++. Lumayan hemat 300K. Kamu kalau langganan IndiHome wajib ambil 1P saja.","1803344927436456421","","","in","indonesia","0","1","0","https://x.com/FebriTriHarmoko/status/1803344927436456421","1117436973986095106","FebriTriHarmoko"
"1803022900058103941","Tue Jun 18 11:12:12 +0000 2024","0","indihome lelet bejillll","1803022900058103941","","","in","gala bunga matahari","0","2","0","https://x.com/moonhearthless/status/1803022900058103941","1697482355467005952","moonhearthless"
"1802959704672587825","Tue Jun 18 07:01:05 +0000 2024","0","Warga Solo sini merapat! Siapa yang mau makan gratis? Setelah sukses di Semarang kini saatnya datang ke Kuliner Tjap Legende Solo di The Park Mall Tanggal 19 - 30 Juni. Ada voucher untuk makan gratis khusus kamu yang mampir ke tenant Indihome. Jangan sampai ketinggalan! https://t.co/4Y7cVO60n4","1802959704672587825","https://pbs.twimg.com/media/GQVmOwlbcAAgZjA.jpg","","in","ÜT: -6.277003,106.807351","0","0","0","https://x.com/detikfood/status/1802959704672587825","100182925","detikfood"
"1803792825181716986","Thu Jun 20 14:11:37 +0000 2024","0","Kiamat buat Indihome / Telkom maksud u","1803792825181716986","","","in","Somewhere","0","0","0","https://x.com/akira_pastoria/status/1803792825181716986","505837674","akira_pastoria"
"1803444689787658718","Wed Jun 19 15:08:15 +0000 2024","0","indihome bakal ada gangguan jam 11 nanti??","1803444689787658718","","","in","kelurahan Asgard","1","3","0","https://x.com/syfrdhoo/status/1803444689787658718","1258721289453236226","syfrdhoo"
"1803775757308858776","Thu Jun 20 13:03:47 +0000 2024","1","ancrit indihome jelek bgt sialan","1803775757308858776","","","in","she/her 🚩","0","3","0","https://x.com/penaecony/status/1803775757308858776","1527522212365840385","penaecony"
"1803347246500765851","Wed Jun 19 08:41:02 +0000 2024","0","IndiHome bangsat @IndiHomeCare","1803347246500765851","","","in","kolong langit","0","1","0","https://x.com/chikaldimas/status/1803347246500765851","3013990686","chikaldimas"
"1803939383214793019","Thu Jun 20 23:53:59 +0000 2024","0","ini indihome gangguan kah","1803939383214793019","","","in","Indonesia","0","4","0","https://x.com/dntkoco_/status/1803939383214793019","1200076422657667072","dntkoco_"
"1803350255657734372","Wed Jun 19 08:53:00 +0000 2024","1","Untuk Bestee aku biar makin update tentang pengetahuannya. Bisa langsung langganan IndiHome sekarang juga! https://t.co/wc3XSjWDWA #IndiHomeMbois #IndiHome https://t.co/SYgOdnfPLc","1803350255657734372","https://pbs.twimg.com/media/GQZpiAmaIAIfeDX.jpg","","in","Kota Semarang, Jawa Tengah","0","0","1","https://x.com/IndihomeJTD/status/1803350255657734372","196499091","IndihomeJTD"
"1803018458554384519","Tue Jun 18 10:54:33 +0000 2024","0","Wow tiba tiba harga naikpemberitahuan kagak ada kemarin tgl 15 masih 390 tiba-tiba naik 420 gimana ini diem diem baeee takut starlink kah butuh biaya anggaran kah pelanggan dikibulin mulu dah @IndiHomeCare @IndiHome https://t.co/KFLATzZxCB","1803018458554384519","https://pbs.twimg.com/media/GQWbuzmboAAReAp.jpg","","in","","0","1","0","https://x.com/rif_afi/status/1803018458554384519","1128689735055003648","rif_afi"
"1803088604732018880","Tue Jun 18 15:33:17 +0000 2024","0","Napa ye indihome kayak pepek tiap bang windah lagi live","1803088604732018880","","","in","","0","1","0","https://x.com/engarlde/status/1803088604732018880","1368782732","engarlde"
"1803356709282337087","Wed Jun 19 09:18:38 +0000 2024","0","selamat siang min indihome ku kenapa jadi lemot ya dari 2 hari yang lalu. Padahal sudah dibayar dari tgl 10 @IndiHomeCare","1803356709282337087","","","in","Jalan Allah SWT","0","0","0","https://x.com/wandaronaa/status/1803356709282337087","362412466","wandaronaa"
"1803802769356382239","Thu Jun 20 14:51:07 +0000 2024","0","Twitter pake indihome mulai lemot nih pertanda kah??","1803802769356382239","","","in","West Java, Indonesia","0","1","0","https://x.com/hanfarhaaann/status/1803802769356382239","1182247003469668352","hanfarhaaann"
"1803284266949943736","Wed Jun 19 04:30:47 +0000 2024","0","aduuuh indihome tolong lemot bgt heran","1803284266949943736","","","in","","0","1","0","https://x.com/dernfromyou/status/1803284266949943736","1524390384553447424","dernfromyou"
"1803461213323665872","Wed Jun 19 16:13:54 +0000 2024","0","Indihome bapukyauda iya akubobo aj uda","1803461213323665872","","","in","a😑b😑e😑","0","0","0","https://x.com/gerdkumat/status/1803461213323665872","1750787177632718848","gerdkumat"
"1803284636329759173","Wed Jun 19 04:32:15 +0000 2024","0","indihome gangguan yhhh ini nelp cs lama bgt diangkatnya","1803284636329759173","","","in","","0","1","0","https://x.com/neennss/status/1803284636329759173","3222423240","neennss"
"1803320056538894645","Wed Jun 19 06:53:00 +0000 2024","1","Untuk Bestee aku biar makin update tentang pengetahuannya. Jangan lupa follow akun Instagram @IndiHome.JatimBaliNusra dan @IndiHomeJTD juga ya bestee #IndiHomeMbois #IndiHome https://t.co/NNhlNawbo0","1803320056538894645","https://pbs.twimg.com/media/GQZpeYQaQAAhWgk.jpg","","in","Kota Semarang, Jawa Tengah","0","0","1","https://x.com/IndihomeJTD/status/1803320056538894645","196499091","IndihomeJTD"
"1803442887964697071","Wed Jun 19 15:01:05 +0000 2024","1","apasih Indihome ini kumat lagi leletnya","1803442887964697071","","","in","unlabeled","0","1","0","https://x.com/aidelaide/status/1803442887964697071","1573810996581634050","aidelaide"
"1803210250360922133","Tue Jun 18 23:36:40 +0000 2024","0","admin indihome mana ya? mau nanya2 nih","1803210250360922133","","","in","","0","1","0","https://x.com/zxnothingtosay/status/1803210250360922133","1687773120592314368","zxnothingtosay"
"1803797223580594245","Thu Jun 20 14:29:05 +0000 2024","0","Top 5 mimin indihome terasik: 1. Ezzi 2. Draken 3. Sira 4. Duwi 5. Tammy Setuju gak ges??? ","1803797223580594245","","","in","manchester united","0","1","0","https://x.com/ElSuKitFamS/status/1803797223580594245","396349033","ElSuKitFamS"
"1803374325212610668","Wed Jun 19 10:28:38 +0000 2024","0","Indihome error kah? Lemot bgt anjir gabisa kerja gue.","1803374325212610668","","","in","gamer.","0","2","0","https://x.com/tiyghnari/status/1803374325212610668","1406967689600323590","tiyghnari"
"1803273608250400997","Wed Jun 19 03:48:26 +0000 2024","2","Ini indihome kenapaa sihhh jelek banget jaringannya","1803273608250400997","","","in","","0","1","0","https://x.com/cegilhappy/status/1803273608250400997","1585930775018758150","cegilhappy"
"1803664576556503157","Thu Jun 20 05:42:00 +0000 2024","1","Untuk Bestee aku biar makin update tentang pengetahuannya. Bisa langsung langganan IndiHome sekarang juga! https://t.co/wc3XSjXbM8 #IndiHomeMbois #IndiHome https://t.co/mmLR6ZMkSW","1803664576556503157","https://pbs.twimg.com/media/GQewhThakAAkv_h.jpg","","in","Kota Semarang, Jawa Tengah","0","0","1","https://x.com/IndihomeJTD/status/1803664576556503157","196499091","IndihomeJTD"
"1803449665117171870","Wed Jun 19 15:28:01 +0000 2024","0","indihome lemot kali bahh","1803449665117171870","","","tl","","0","1","0","https://x.com/mkrisnamm/status/1803449665117171870","1149582786614849538","mkrisnamm"
"1803646948349792265","Thu Jun 20 04:31:57 +0000 2024","0","indihome tiap tanggal segini kebiasaan","1803646948349792265","","","in","Indonesia","0","0","0","https://x.com/vannylalattee/status/1803646948349792265","1157823650780737536","vannylalattee"
"1803913960468680870","Thu Jun 20 22:12:57 +0000 2024","0","Indihome kenapasi? Bangke banget","1803913960468680870","","","in","Knowhere","0","1","0","https://x.com/misuhbrutall/status/1803913960468680870","1865942671","misuhbrutall"
"1803841979530592516","Thu Jun 20 17:26:56 +0000 2024","0","Kenapa gabisa dibayar nih wifinya @IndiHome ? Dari jam 11 loh","1803841979530592516","","","in","apoteker ","0","1","0","https://x.com/jihanspage/status/1803841979530592516","565603614","jihanspage"
"1803249303978385639","Wed Jun 19 02:11:51 +0000 2024","0","Cek dm kak @IndiHomeCare @IndiHome","1803249303978385639","","","in","Indonesia","0","0","0","https://x.com/deviirhm/status/1803249303978385639","497545705","deviirhm"
"1803883449524359650","Thu Jun 20 20:11:43 +0000 2024","0","indihome.. lagi dan lagi","1803883449524359650","","","in","Kota Hujan","0","1","1","https://x.com/QG_Lite/status/1803883449524359650","1543681579817390081","QG_Lite"
"1803824407883997458","Thu Jun 20 16:17:06 +0000 2024","0","ni indihome knp 403 dah","1803824407883997458","","","in","she/her","0","1","0","https://x.com/onenonlytw/status/1803824407883997458","1244536574689161216","onenonlytw"
